9781932416374,1932416374,The Very Persistent Gappers of Frip,George Saunders;Lane Smith,Juvenile Fiction,http://books.google.com/books/content?id=xYJOPgAACAAJ&printsec=frontcover&img=1&zoom=1&source=gbs_api,"A novel set in the seaside village of Frip follows the adventures of a community plagued by ""gappers""--orange sea creatures that cover the village's goats and prevent them from giving milk.",2006.0,4.11,84.0,2317.0,The Very Persistent Gappers of Frip,"9781932416374 A novel set in the seaside village of Frip follows the adventures of a community plagued by ""gappers""--orange sea creatures that cover the village's goats and prevent them from giving milk."
9781932416381,1932416382,McSweeney's,Dave Eggers,Fiction,http://books.google.com/books/content?id=PYLUzAEACAAJ&printsec=frontcover&img=1&zoom=1&source=gbs_api,"Presents a new compilation of writings from the popular literary journal, which began in the 1998 as a small literary journal that published only works rejected from other magazines, including an excerpt from Edmund White's new memoir My Hustlers, as well as works by Jonathan Lethem, William T. Vollmann, David Foster Wallace, Rick Moody, and many new talents.",2005.0,3.72,200.0,401.0,McSweeney's,"9781932416381 Presents a new compilation of writings from the popular literary journal, which began in the 1998 as a small literary journal that published only works rejected from other magazines, including an excerpt from Edmund White's new memoir My Hustlers, as well as works by Jonathan Lethem, William T. Vollmann, David Foster Wallace, Rick Moody, and many new talents."
9781932416480,193241648X,McSweeney's,T. C. Boyle,Fiction,http://books.google.com/books/content?id=N5nFAAAACAAJ&printsec=frontcover&img=1&zoom=1&source=gbs_api,"The latest collection from the literary journal that publishes only works rejected from other magazines, and is committed to publishing work of gifted but underappreciated writers, is presented.",2006.0,3.8,250.0,303.0,McSweeney's,"9781932416480 The latest collection from the literary journal that publishes only works rejected from other magazines, and is committed to publishing work of gifted but underappreciated writers, is presented."
9781932416640,1932416641,What is the what,Dave Eggers,Fiction,http://books.google.com/books/content?id=Ps8LAQAAMAAJ&printsec=frontcover&img=1&zoom=1&source=gbs_api,"A biographical novel traces the story of Valentino Achak Deng, who as a boy of seven was separated from his family when his village in southern Sudan was attacked by government helicopters and became one of the estimated 17,000 ""lost boys of Sudan"" before",2006.0,4.16,475.0,64088.0,What is the what: The Autobiography of Valentino Achak Deng : a Novel,"9781932416640 A biographical novel traces the story of Valentino Achak Deng, who as a boy of seven was separated from his family when his village in southern Sudan was attacked by government helicopters and became one of the estimated 17,000 ""lost boys of Sudan"" before"
9781932416770,1932416773,McSweeney's,Dave Eggers,Fiction,http://books.google.com/books/content?id=o7cuHQAACAAJ&printsec=frontcover&img=1&zoom=1&source=gbs_api,"With a special section on Donald Barthelme, including remembrances from Ann Beattie, David Gates, and Oscar Hijuelos, and some of Barthelme's barely published and never-collected early work, and a highly theoretical but potentially amazing Z-binding that we can't describe very well here, or even to each other, McSweeney's 24 will never be mistaken for anything else. (Except possibly the June 1978 issue of Popular Mechanics.)",2007.0,3.81,300.0,275.0,McSweeney's,"9781932416770 With a special section on Donald Barthelme, including remembrances from Ann Beattie, David Gates, and Oscar Hijuelos, and some of Barthelme's barely published and never-collected early work, and a highly theoretical but potentially amazing Z-binding that we can't describe very well here, or even to each other, McSweeney's 24 will never be mistaken for anything else. (Except possibly the June 1978 issue of Popular Mechanics.)"
9781932420302,1932420304,Erotica,Kelly Carr,Fiction,http://books.google.com/books/content?id=5TS3AgAAQBAJ&printsec=frontcover&img=1&zoom=1&source=gbs_api,"""My Dirty Thirties"" takes female empowerment to new levels with a series of erotic novels about women in their 30s who can't say no to their desires. (Adult Fiction)",2004.0,2.44,152.0,6.0,Erotica: My Dirty Thirties: Male/Female/Male,"9781932420302 ""My Dirty Thirties"" takes female empowerment to new levels with a series of erotic novels about women in their 30s who can't say no to their desires. (Adult Fiction)"
9781932420340,1932420347,Erotica,Kelly Carr,Fiction,http://books.google.com/books/content?id=MGPKwAEACAAJ&printsec=frontcover&img=1&zoom=1&source=gbs_api,"Romantic Hedonism: What happens when a woman meets the man of her dreams in London? She prays her husband doesn't find out. My Dirty Thirties is a series of erotic novels about women in their thirties who can't say no to their desires. Call it ""The Thing"" or call it sexual peak, but once it happens, there's no turning back. It takes female empowerment to new levels. Romantic Hedonism is the second book in the series.",2004.0,3.0,144.0,8.0,"Erotica: My Dirty Thirties, Romantic Hedonism","9781932420340 Romantic Hedonism: What happens when a woman meets the man of her dreams in London? She prays her husband doesn't find out. My Dirty Thirties is a series of erotic novels about women in their thirties who can't say no to their desires. Call it ""The Thing"" or call it sexual peak, but once it happens, there's no turning back. It takes female empowerment to new levels. Romantic Hedonism is the second book in the series."
9781932664393,1932664394,Han'guk-sik Sarang,J. Torres,Comics & Graphic Novels,http://books.google.com/books/content?id=V1Fex6gnO_oC&printsec=frontcover&img=1&zoom=1&source=gbs_api,"Joel, an English teacher, has never really liked Korea, but he decides to extend his stay so that he can pursue Hana, the new receptionist at his school.",2006.0,3.44,58.0,9.0,Han'guk-sik Sarang,"9781932664393 Joel, an English teacher, has never really liked Korea, but he decides to extend his stay so that he can pursue Hana, the new receptionist at his school."
9781932664591,1932664599,Wasteland Vol. 1,Antony Johnston,Comics & Graphic Novels,http://books.google.com/books/content?id=8K7CPAAACAAJ&printsec=frontcover&img=1&zoom=1&source=gbs_api,"A hundred years after the Big Wet, Earth has been left a broken, infertile world of rock and sand. The town of Providens is like many others on the post-Big Wet planet—small, mostly illiterate and struggling for survival. But while most communities are like Providens, not all the cities that survived the Big Wet are. Some are like Newbegin, burgeoning metropolises that combine pieces of past societies with the new status quo. When Providens welcomes a stranger named Michael into its midst, will the quiet man lead them to the better world of Newbegin or shatter what little order still exists?",2010.0,3.56,160.0,569.0,Wasteland Vol. 1: Cities in Dust,"9781932664591 A hundred years after the Big Wet, Earth has been left a broken, infertile world of rock and sand. The town of Providens is like many others on the post-Big Wet planet—small, mostly illiterate and struggling for survival. But while most communities are like Providens, not all the cities that survived the Big Wet are. Some are like Newbegin, burgeoning metropolises that combine pieces of past societies with the new status quo. When Providens welcomes a stranger named Michael into its midst, will the quiet man lead them to the better world of Newbegin or shatter what little order still exists?"
9781932796780,1932796789,Dragons of Winter Night,Margaret Weis;Tracy Hickman;Andrew Dabb,Comics & Graphic Novels,http://books.google.com/books/content?id=92L9uAEACAAJ&printsec=frontcover&img=1&zoom=1&source=gbs_api,"When dragons invade the land, a small band of heroes, including a knight, barbarian, dwarf, and half-elf, begin the search for the magical Dragon Orb and Dragonlance, in the second volume of the Dragonlance Chronicles in a graphic novel format. Original.",2007.0,4.14,358.0,33846.0,Dragons of Winter Night,"9781932796780 When dragons invade the land, a small band of heroes, including a knight, barbarian, dwarf, and half-elf, begin the search for the magical Dragon Orb and Dragonlance, in the second volume of the Dragonlance Chronicles in a graphic novel format. Original."
9781932855418,1932855416,Bird Songs,Les Beletsky,Nature,http://books.google.com/books/content?id=InkFAgAACAAJ&printsec=frontcover&img=1&zoom=1&source=gbs_api,"Drawing from the collection of the world-renowned Macaulay Library at the Cornell Lab of Ornithology, Bird Songs presents the most notable North American birdsincluding the rediscovered Ivory-billed Woodpeckerin a stunning new format. Renowned bird biologist Les Beletsky provides a succinct description of each of the 250 birds profiled, with an emphasis on their distinctive songs. Lavish full-color illustrations accompany each account, while a sleek, built-in digital audio player holds 250 corresponding songs and calls. In his foreword, North American bird expert and distinguished natural historian Jon L. Dunn shares insights gained from a lifetime of passionate study. Complete with the most up-to-date and scientifically accurate information, Bird Songs is the first book to capture the enchantment of these beautiful birds in words, pictures, and song. The Cornell Lab of Ornithology, located in Ithaca, New York, is a nonprofit institution focused on birds and whose mission is to interpret and conserve the earth's biological diversity through research. The Macaulay Library at the Cornell Lab is the major source of sound recordings of birds for research, education, conservation, the media, and commercial products. Listen here Trumpeter Swan Laughing Gull Eastern Bluebird",2006.0,4.47,368.0,268.0,Bird Songs: 250 North American Birds in Song,"9781932855418 Drawing from the collection of the world-renowned Macaulay Library at the Cornell Lab of Ornithology, Bird Songs presents the most notable North American birdsincluding the rediscovered Ivory-billed Woodpeckerin a stunning new format. Renowned bird biologist Les Beletsky provides a succinct description of each of the 250 birds profiled, with an emphasis on their distinctive songs. Lavish full-color illustrations accompany each account, while a sleek, built-in digital audio player holds 250 corresponding songs and calls. In his foreword, North American bird expert and distinguished natural historian Jon L. Dunn shares insights gained from a lifetime of passionate study. Complete with the most up-to-date and scientifically accurate information, Bird Songs is the first book to capture the enchantment of these beautiful birds in words, pictures, and song. The Cornell Lab of Ornithology, located in Ithaca, New York, is a nonprofit institution focused on birds and whose mission is to interpret and conserve the earth's biological diversity through research. The Macaulay Library at the Cornell Lab is the major source of sound recordings of birds for research, education, conservation, the media, and commercial products. Listen here Trumpeter Swan Laughing Gull Eastern Bluebird"
9781932857085,1932857087,Real Rule of Four,Joscelyn Godwin,History,http://books.google.com/books/content?id=X2-fil65OT4C&printsec=frontcover&img=1&zoom=1&source=gbs_api,"Discusses the historical and intellectual background of the novel ""The Rule of Four,"" examining the 1499 Renaissance text that forms the central theme of the novel.",2004.0,3.45,208.0,88.0,Real Rule of Four: The Unauthorized Guide to the New York Times #1 Bestseller,"9781932857085 Discusses the historical and intellectual background of the novel ""The Rule of Four,"" examining the 1499 Renaissance text that forms the central theme of the novel."
9781933045252,1933045256,Design Like You Give a Damn,Architecture for Humanity (Organization),Architecture,http://books.google.com/books/content?id=jIJuQgAACAAJ&printsec=frontcover&img=1&zoom=1&source=gbs_api,"Citing a harrowing lack of adequate shelter and utilities for nearly half the planet's population, a compendium of innovative architectural projects from around the world features more than 80 ideas designed to address specific urgent needs in desperately underprivileged areas.",2006.0,4.11,336.0,770.0,Design Like You Give a Damn: Architectural Responses to Humanitarian Crises,"9781933045252 Citing a harrowing lack of adequate shelter and utilities for nearly half the planet's population, a compendium of innovative architectural projects from around the world features more than 80 ideas designed to address specific urgent needs in desperately underprivileged areas."
9781933110332,1933110333,A Matter of Trust,Radclyffe,Fiction,http://books.google.com/books/content?id=yb5UJkTy6woC&printsec=frontcover&img=1&zoom=1&source=gbs_api,"Michael Lassiter hires J.T. Sloan, a security consultant, to protect his company. Sloan shares a painful past with her associate & friend Jason McBride. Sarah Martin, is a gentle practitioner of eastern medicine. Four very different people, each wounded by personal beytrayal, find their lives inextricably linked.",2006.0,4.2,240.0,910.0,A Matter of Trust,"9781933110332 Michael Lassiter hires J.T. Sloan, a security consultant, to protect his company. Sloan shares a painful past with her associate & friend Jason McBride. Sarah Martin, is a gentle practitioner of eastern medicine. Four very different people, each wounded by personal beytrayal, find their lives inextricably linked."
9781933110455,1933110457,Carly's Sound,Ali Vali,Fiction,http://books.google.com/books/content?id=vAvDwAEACAAJ&printsec=frontcover&img=1&zoom=1&source=gbs_api,"Is passion still possible the second time around? Poppy Valente has the world in the palm of her hand until fate steals from her the one thing that matters most--her wife Carly. When breast cancer ends their life together, Poppy finds herself at a loss. Julia Johnson is running to Carly's Sound with her newborn daughter Tallulah in search of the path to her future. On a chance meeting two years after Carly's death, these two women form a bond of friendship that lays the foundation for something more.",2006.0,4.21,212.0,441.0,Carly's Sound,"9781933110455 Is passion still possible the second time around? Poppy Valente has the world in the palm of her hand until fate steals from her the one thing that matters most--her wife Carly. When breast cancer ends their life together, Poppy finds herself at a loss. Julia Johnson is running to Carly's Sound with her newborn daughter Tallulah in search of the path to her future. On a chance meeting two years after Carly's death, these two women form a bond of friendship that lays the foundation for something more."
9781933368368,1933368365,The Good Fairies of New York,Martin Millar,Fiction,http://books.google.com/books/content?id=XbspqbaIgy0C&printsec=frontcover&img=1&zoom=1&source=gbs_api,"Finding themselves in the very unusual world of Manhattan, a pair of Scottish thimble fairies apply their folk wisdom to assist a pair of down-and-out humans, including Kerry, who struggles with a colostomy bag, and Dinnie, who exhibits anti-social behaviors. Original.",2006.0,3.51,242.0,4280.0,The Good Fairies of New York,"9781933368368 Finding themselves in the very unusual world of Manhattan, a pair of Scottish thimble fairies apply their folk wisdom to assist a pair of down-and-out humans, including Kerry, who struggles with a colostomy bag, and Dinnie, who exhibits anti-social behaviors. Original."
9781933368566,193336856X,Mitz,Sigrid Nuez,Fiction,http://books.google.com/books/content?id=9heK_IYC5ewC&printsec=frontcover&img=1&zoom=1&edge=curl&source=gbs_api,"In 1934, a ""sickly pathetic marmoset"" named Mitz came into the care of Leonard Woolf. After nursing her back to health, he was rarely seen without the amusing monkey on his shoulder. A ubiquitous presence in Bloomsbury society, Mitz moved with the Woolfs between their homes in London and Sussex. She developed her own special relationships with the family's cocker spaniels and with the various members of the Woolfs' circle, among them T. S. Eliot and Vita Sackville-West. Mitz even played a vital role in helping the Woolfs escape a close call with Nazis in Germany just before World War II. Blending letters, diaries, and memoirs, acclaimed novelist Sigrid Nunez reconstructs Mitz's life, painting it against the fascinating backdrop of Bloomsbury in its twilight years. Tender, affectionate, and filled with humor, this novel offers a striking look at lives shadowed by war, death, and mental breakdown, as well as the happiness and productivity this plucky creature inspired.",2007.0,3.7,128.0,102.0,Mitz: The Marmoset of Bloomsbury,"9781933368566 In 1934, a ""sickly pathetic marmoset"" named Mitz came into the care of Leonard Woolf. After nursing her back to health, he was rarely seen without the amusing monkey on his shoulder. A ubiquitous presence in Bloomsbury society, Mitz moved with the Woolfs between their homes in London and Sussex. She developed her own special relationships with the family's cocker spaniels and with the various members of the Woolfs' circle, among them T. S. Eliot and Vita Sackville-West. Mitz even played a vital role in helping the Woolfs escape a close call with Nazis in Germany just before World War II. Blending letters, diaries, and memoirs, acclaimed novelist Sigrid Nunez reconstructs Mitz's life, painting it against the fascinating backdrop of Bloomsbury in its twilight years. Tender, affectionate, and filled with humor, this novel offers a striking look at lives shadowed by war, death, and mental breakdown, as well as the happiness and productivity this plucky creature inspired."
9781933372198,1933372192,Amazing Disgrace,James Hamilton-Paterson,Fiction,http://books.google.com/books/content?id=s7jyAAAAMAAJ&printsec=frontcover&img=1&zoom=1&source=gbs_api,"In this sequel to the popular Cooking with Fernet Branca, Gerald Samper is back on his Tuscan hilltop and busily musing on the absurdities of modern life. His entertaining asides - on everything from publishing to penile implants, celebrity sportswomen to Australian media moguls - and his eccentric recipes form the comic heart of this literary romp. Marta, Gerald's nemesis in Cooking with Fernet Branca, is back, along with her penchant for the eponymous potent liquor and her talent for shattering Gerald's evening idylls. But she's not alone: Amazing Disgrace touts a cavalcade of memorable characters, including a foul-mouthed, one-armed yachtswoman, and sees Gerald jettisoned from his Tuscan hideaway into the trendy haunts of his native London.",2006.0,3.79,320.0,219.0,Amazing Disgrace,"9781933372198 In this sequel to the popular Cooking with Fernet Branca, Gerald Samper is back on his Tuscan hilltop and busily musing on the absurdities of modern life. His entertaining asides - on everything from publishing to penile implants, celebrity sportswomen to Australian media moguls - and his eccentric recipes form the comic heart of this literary romp. Marta, Gerald's nemesis in Cooking with Fernet Branca, is back, along with her penchant for the eponymous potent liquor and her talent for shattering Gerald's evening idylls. But she's not alone: Amazing Disgrace touts a cavalcade of memorable characters, including a foul-mouthed, one-armed yachtswoman, and sees Gerald jettisoned from his Tuscan hideaway into the trendy haunts of his native London."
9781933440170,1933440171,Finder Series,Ayano Yamane,Gay men,,"Chinese crime lord Fei Long comes to Japan hoping to lure freelance photographer Akihito into his web of intrigue and sex. When his friends fall for Fei Long's schemes, Akihito has only one person to turn to for help--Asami, the Yakuza boss who once made Akihito his sex slave.",2007.0,4.35,208.0,562.0,Finder Series: One wing in the finder,"9781933440170 Chinese crime lord Fei Long comes to Japan hoping to lure freelance photographer Akihito into his web of intrigue and sex. When his friends fall for Fei Long's schemes, Akihito has only one person to turn to for help--Asami, the Yakuza boss who once made Akihito his sex slave."
9781933615097,1933615095,The Best of America's Test Kitchen 2007,America's Test Kitchen,Cooking,http://books.google.com/books/content?id=tQ97AAAACAAJ&printsec=frontcover&img=1&zoom=1&source=gbs_api,"Presents nearly one thousand recipes--from appetizers and salads to entrees and desserts--developed by America's Test Kitchen chefs, along with tips for choosing equipment, preparing food, or saving money in the kitchen.",2006.0,4.34,312.0,185.0,"The Best of America's Test Kitchen 2007: The Year's Best Recipes, Equipment Reviews, and Tastings","9781933615097 Presents nearly one thousand recipes--from appetizers and salads to entrees and desserts--developed by America's Test Kitchen chefs, along with tips for choosing equipment, preparing food, or saving money in the kitchen."
9781933633107,1933633107,Sister Bernadette's Barking Dog,Kitty Burns Florey,Literary Collections,http://books.google.com/books/content?id=LItiAAAAMAAJ&printsec=frontcover&img=1&zoom=1&source=gbs_api,"In this illustrated personal history, Kitty Burns Florey explores the rise and fall of sentence diagramming, including its invention by a mustachioed man named Brainerd 'Brainy' Kellogg and his wealthy accomplice Alonzo Reed - the inferior 'balloon diagram' predecessor - and what diagrams of sentences by Hemingway, Welty, Proust, Kerouac and other famous writers reveal about them. Florey also answers some of literature's most pressing questions: Was Mark Twain or James Fenimore Cooper a better grammarian? What are the silliest grammar rules?",2006.0,3.59,154.0,678.0,Sister Bernadette's Barking Dog: The Quirky History and Lost Art of Diagramming Sentences,"9781933633107 In this illustrated personal history, Kitty Burns Florey explores the rise and fall of sentence diagramming, including its invention by a mustachioed man named Brainerd 'Brainy' Kellogg and his wealthy accomplice Alonzo Reed - the inferior 'balloon diagram' predecessor - and what diagrams of sentences by Hemingway, Welty, Proust, Kerouac and other famous writers reveal about them. Florey also answers some of literature's most pressing questions: Was Mark Twain or James Fenimore Cooper a better grammarian? What are the silliest grammar rules?"
9781933648279,1933648279,Night Has a Thousand Eyes,Cornell Woolrich,Fiction,http://books.google.com/books/content?id=3Gk6swEACAAJ&printsec=frontcover&img=1&zoom=1&source=gbs_api,"""Cornell Woolrich's novels define the essence of noir nihilism.""-Marilyn Stasio, The New York Times Book Review One of Woolrich's most famous novels, this classic noir tale of a con man struggling with his ability to see the future is arguably the author's best in its depiction of his vision of doomed predestination. From the 1930s until his death in 1968, Cornell Woolrich riveted the reading public with his unparalleled suspense stories. Classic films like Alfred Hitchcock's Rear Window and novels such as Rendezvous in Black earned Woolrich epithets like ""the twentieth century's Edgar Allan Poe"" and ""the father of noir.""",2007.0,3.77,344.0,680.0,Night Has a Thousand Eyes,"9781933648279 ""Cornell Woolrich's novels define the essence of noir nihilism.""-Marilyn Stasio, The New York Times Book Review One of Woolrich's most famous novels, this classic noir tale of a con man struggling with his ability to see the future is arguably the author's best in its depiction of his vision of doomed predestination. From the 1930s until his death in 1968, Cornell Woolrich riveted the reading public with his unparalleled suspense stories. Classic films like Alfred Hitchcock's Rear Window and novels such as Rendezvous in Black earned Woolrich epithets like ""the twentieth century's Edgar Allan Poe"" and ""the father of noir."""
9781933771137,1933771135,Neptune Noir,Rob Thomas;Leah Wilson,Performing Arts,http://books.google.com/books/content?id=VHu3waVCobIC&printsec=frontcover&img=1&zoom=1&edge=curl&source=gbs_api,"Edited by the creator and executive producer of the teen detective show, a collection of essays address such varied subjects as Veronica's vigilante justice and Veronica and Loganâ€™s everchanging relationship.",2007.0,3.64,224.0,911.0,Neptune Noir: Unauthorized Investigations Into Veronica Mars,"9781933771137 Edited by the creator and executive producer of the teen detective show, a collection of essays address such varied subjects as Veronica's vigilante justice and Veronica and Loganâ€™s everchanging relationship."
