9781930901353,1930901356,The Irish Anatomist,Keith Donohue,Biography & Autobiography,http://books.google.com/books/content?id=baEJAAAACAAJ&printsec=frontcover&img=1&zoom=1&source=gbs_api,"The most full length critical and biographical studies of Flann O'Brien(the nom de plume of Brian O' Nolan an otherwise inoffensive Irish public servant) tend to push asid e the leviathan of Cruiskeen Lawn, a commodious, encyclopedic work of some two million words and focus instead on his novels in English. Dr. Donohue in this important new study considers all of O'Nolan's work including college writings, letters to the editor(raised to a form of national genius by F O'B.) and works in Irish. It draws upon the research and biographical material of Anthony Cronin's No Laughing Matter, along with new research and criticism and takes issue with some of the conclusions reached in Keith Hopper's A Portrait of a Postmodernist. By tracing O'Nolan's development as an artist over time, this new study uncovers the relentless anatomist and post modernist in Flann O'Brien, a man of genius dissecting and exposing life and custom in mid 20th century Dublin. O'Nolan's views on the arts and the novel are carefully discussed along with his relation to the literary Ireland of the deValera years.",2002.0,5.0,222.0,1.0,The Irish Anatomist: A Study of Flann O'Brien,"9781930901353 The most full length critical and biographical studies of Flann O'Brien(the nom de plume of Brian O' Nolan an otherwise inoffensive Irish public servant) tend to push asid e the leviathan of Cruiskeen Lawn, a commodious, encyclopedic work of some two million words and focus instead on his novels in English. Dr. Donohue in this important new study considers all of O'Nolan's work including college writings, letters to the editor(raised to a form of national genius by F O'B.) and works in Irish. It draws upon the research and biographical material of Anthony Cronin's No Laughing Matter, along with new research and criticism and takes issue with some of the conclusions reached in Keith Hopper's A Portrait of a Postmodernist. By tracing O'Nolan's development as an artist over time, this new study uncovers the relentless anatomist and post modernist in Flann O'Brien, a man of genius dissecting and exposing life and custom in mid 20th century Dublin. O'Nolan's views on the arts and the novel are carefully discussed along with his relation to the literary Ireland of the deValera years."
9781931082549,1931082545,Democracy in America,Alexis de Tocqueville;Arthur Goldhammer,Philosophy,http://books.google.com/books/content?id=UXkJ0gvjS0AC&printsec=frontcover&img=1&zoom=1&edge=curl&source=gbs_api,"An influential study of America's national government, egalitarian ideals, and character offers reflections on the effect of majority rule on the rights of individuals and provides insight into the rewards and responsibilities of a democratic government, in a clear new translation of the nineteenth-century classic.",2004.0,4.02,928.0,173.0,Democracy in America,"9781931082549 An influential study of America's national government, egalitarian ideals, and character offers reflections on the effect of majority rule on the rights of individuals and provides insight into the rewards and responsibilities of a democratic government, in a clear new translation of the nineteenth-century classic."
9781931082730,1931082731,Little Women ; Little Men ; Jo's Boys,Louisa May Alcott;Elaine Showalter,Fiction,http://books.google.com/books/content?id=q9SmFnhNNfYC&printsec=frontcover&img=1&zoom=1&edge=curl&source=gbs_api,"A deluxe single-volume edition of Alcott's classic Little Women trilogy is complemented by the stories' original first-edition illustrations, some of which where drawn by the author's sister May, who inspired the character of Amy.",2005.0,4.31,1045.0,2949.0,Little Women ; Little Men ; Jo's Boys,"9781931082730 A deluxe single-volume edition of Alcott's classic Little Women trilogy is complemented by the stories' original first-edition illustrations, some of which where drawn by the author's sister May, who inspired the character of Amy."
9781931414166,1931414165,The Brooklyn Bridge,Elizabeth Mann;Alan Witschonke,Juvenile Nonfiction,http://books.google.com/books/content?id=s28MAgAACAAJ&printsec=frontcover&img=1&zoom=1&source=gbs_api,"Describes the construction of the Brooklyn Bridge, from its conception by John Roebling in 1852 through its final completion under the direction of his son, Washington, in 1883.",2006.0,4.44,46.0,35.0,The Brooklyn Bridge,"9781931414166 Describes the construction of the Brooklyn Bridge, from its conception by John Roebling in 1852 through its final completion under the direction of his son, Washington, in 1883."
9781931615037,1931615039,Answers to Questions Teachers Ask about Sensory Integration,Carol Stock Kranowitz;Stacey Szklut;Lynn Balzer-Martin;Elizabeth Haber;Deanna Iris Sava,Minimal brain dysfunction in children,http://books.google.com/books/content?id=3_9kPgAACAAJ&printsec=frontcover&img=1&zoom=1&source=gbs_api,"In this elegant approach to the often elusive subject of sensory integration, Kranowitz, author of the bestselling ""The Out-of-Sync Child,"" and expert occupational therapists present an extensive and easy-to-use set of checklists and other tools that are invaluable to every teacher and parent who has children with sensory integration challenges.",2001.0,4.12,63.0,17.0,"Answers to Questions Teachers Ask about Sensory Integration: Forms, Checklists, and Practical Tools for Teachers and Parents","9781931615037 In this elegant approach to the often elusive subject of sensory integration, Kranowitz, author of the bestselling ""The Out-of-Sync Child,"" and expert occupational therapists present an extensive and easy-to-use set of checklists and other tools that are invaluable to every teacher and parent who has children with sensory integration challenges."
9781931859356,1931859353,No One is Illegal,Justin Akers Chacón;Mike Davis;Julián Cardona,History,http://books.google.com/books/content?id=4LfbAgAAQBAJ&printsec=frontcover&img=1&zoom=1&edge=curl&source=gbs_api,"Countering the chorus of anti-immigrant voices, Mike Davis and Justin Akers Chacon expose the racism of anti-immigration vigilantes and put a human face on the immigrants who risk their lives to cross the border to work in the United States. |A rare combination of an author, Mike Davis is Rachel Carson and Upton Sinclair all in one.| - Susan Faludi |Davis' writing is perceptive and rigorous.| - David Montgomery, The Nation",2006.0,4.07,240.0,226.0,No One is Illegal: Fighting Violence and State Repression on the U.S.-Mexico Border,"9781931859356 Countering the chorus of anti-immigrant voices, Mike Davis and Justin Akers Chacon expose the racism of anti-immigration vigilantes and put a human face on the immigrants who risk their lives to cross the border to work in the United States. |A rare combination of an author, Mike Davis is Rachel Carson and Upton Sinclair all in one.| - Susan Faludi |Davis' writing is perceptive and rigorous.| - David Montgomery, The Nation"
9781931882200,1931882207,Invisible Residents,Ivan T. Sanderson,"Body, Mind & Spirit",http://books.google.com/books/content?id=_BKYTHMBLj8C&printsec=frontcover&img=1&zoom=1&edge=curl&source=gbs_api,"This book is a groundbreaking contribution to the study of the UFO enigma, originally published over 30 years ago. In this book, Sanderson, a renowned zoologist with a keen interest in the paranormal, puts forward the curious theory that âeoeOINTS""-Other Intelligences-live under the Earthâe(tm)s oceans. This underwater, parallel, civilization may be twice as old as Homo sapiens, he proposes, and may have âeoedeveloped what we call space flight."" Sanderson postulates that the OINTS are behind many UFO sightings as well as the mysterious disappearances of aircraft and ships in the Bermuda Triangle. What better place to have an impenetrable base than deep within the oceans of the planet? Yet, if UFOs, or at least some of them, are coming from beneath our oceans or lakes, does it necessarily mean that there is another civilization besides our own that is responsible? In fact, could it be that since WWII a number of underwater UFO bases have been constructed by the very human governments of our planet? Whatever their source, Sanderson offers here an exhaustive study of USOs (Unidentified Submarine Objects) observed in nearly every part of the world. He presents many well-documented and exciting case studies of these unusual sightings; more.",2005.0,3.68,100.0,59.0,Invisible Residents: The Reality of Underwater UFOs,"9781931882200 This book is a groundbreaking contribution to the study of the UFO enigma, originally published over 30 years ago. In this book, Sanderson, a renowned zoologist with a keen interest in the paranormal, puts forward the curious theory that âeoeOINTS""-Other Intelligences-live under the Earthâe(tm)s oceans. This underwater, parallel, civilization may be twice as old as Homo sapiens, he proposes, and may have âeoedeveloped what we call space flight."" Sanderson postulates that the OINTS are behind many UFO sightings as well as the mysterious disappearances of aircraft and ships in the Bermuda Triangle. What better place to have an impenetrable base than deep within the oceans of the planet? Yet, if UFOs, or at least some of them, are coming from beneath our oceans or lakes, does it necessarily mean that there is another civilization besides our own that is responsible? In fact, could it be that since WWII a number of underwater UFO bases have been constructed by the very human governments of our planet? Whatever their source, Sanderson offers here an exhaustive study of USOs (Unidentified Submarine Objects) observed in nearly every part of the world. He presents many well-documented and exciting case studies of these unusual sightings; more."
9781932073201,1932073205,Way of the Peaceful Warrior,Dan Millman,"Body, Mind & Spirit",http://books.google.com/books/content?id=NEU-1RfOMEwC&printsec=frontcover&img=1&zoom=1&edge=curl&source=gbs_api,"Presents the author's personal account of his spiritual quest to unite the diverse realms of body, mind, and spirit by combining Eastern philosophy with Western fitness routines to become an example of the peaceful warrior.Now a major motion picture from Lionsgate starring Nick Nolte.",2006.0,4.14,240.0,38159.0,Way of the Peaceful Warrior: A Book that Changes Lives,"9781932073201 Presents the author's personal account of his spiritual quest to unite the diverse realms of body, mind, and spirit by combining Eastern philosophy with Western fitness routines to become an example of the peaceful warrior.Now a major motion picture from Lionsgate starring Nick Nolte."
9781932100563,1932100563,The Anthology at the End of the Universe,Glenn Yeffeth,Literary Criticism,http://books.google.com/books/content?id=R7y1PEKjVc0C&printsec=frontcover&img=1&zoom=1&edge=curl&source=gbs_api,"A selection of essays dealing with every aspect of one of the most beloved science fiction series of all time contains work from some of the genre's greats, including Cory Doctorow, Stephen Baxter, and Lawrence Watt-Evans, and covers topics as varied as Vogon poetry to the idea of the Internet becoming a real-life Guide. Original.",2005.0,3.85,240.0,123.0,The Anthology at the End of the Universe: Leading Science Fiction Authors on Douglas Adams' The Hitchhiker's Guide to the Galaxy,"9781932100563 A selection of essays dealing with every aspect of one of the most beloved science fiction series of all time contains work from some of the genre's greats, including Cory Doctorow, Stephen Baxter, and Lawrence Watt-Evans, and covers topics as varied as Vogon poetry to the idea of the Internet becoming a real-life Guide. Original."
9781932206081,1932206086,Insights,Frederick Lenz,Spiritual life,http://books.google.com/books/content?id=NOX2PgAACAAJ&printsec=frontcover&img=1&zoom=1&source=gbs_api,"In 1983, when Rama - Dr. Frederick P. Lenz recorded a series of profound and powerful talks entitled Insights: Talks on the Nature of Existence. This book is a transcript of those talks. Rama was instructing an ever-growing number of students. Dr. Lenz himself was developing an approach to self-realization that, while emphasizing meditation and enlightenment, drew from a variety of traditions including Vedanta, Tibetan Buddhism and the American mystic teachings described by Carlos Castaneda. The Insights talks, which evolved from this time period, are like a crest jewel of Dr. Lenz's body of teachings. It is interesting to note that most of the Insights talks are subtitled ""Modular Mysticism"" (for example, ""Modular Mysticism: The Truth""). Even the talk titled ""How to Make Friends with God"" - discussed in depth only in this series - is termed a part of ""Modular Mysticism."" In the practice of mysticism, Dr. Lenz explains, the student begins to understand awareness and power. Modular mysticism becomes the science of power, and the student learns to gain power, to stop losing power, to store power, and eventually to give power to others. In order to gain power, the student begins to lead an efficient and well-structured life. As the student accomplishes this, they are able to move more easily through the doorways to enlightenment. At each step along the journey of the Insights talks, Dr. Lenz gives specific examples of how to adapt and integrate mystical Buddhist practice into a Western lifestyle. For Dr. Lenz there was no contradiction between being a successful Westerner and a successful Buddhist, be it building a career, working out at the health club, going to the movies, shopping for clothes -- or understanding why more women don't attain enlightenment (when, in fact, it's easier for them to do so). In every instance, Dr. Lenz connects the heights of the mystical experiences directly to our everyday lives.",2003.0,5.0,304.0,1.0,Insights: Talks on the Nature of Existence,"9781932206081 In 1983, when Rama - Dr. Frederick P. Lenz recorded a series of profound and powerful talks entitled Insights: Talks on the Nature of Existence. This book is a transcript of those talks. Rama was instructing an ever-growing number of students. Dr. Lenz himself was developing an approach to self-realization that, while emphasizing meditation and enlightenment, drew from a variety of traditions including Vedanta, Tibetan Buddhism and the American mystic teachings described by Carlos Castaneda. The Insights talks, which evolved from this time period, are like a crest jewel of Dr. Lenz's body of teachings. It is interesting to note that most of the Insights talks are subtitled ""Modular Mysticism"" (for example, ""Modular Mysticism: The Truth""). Even the talk titled ""How to Make Friends with God"" - discussed in depth only in this series - is termed a part of ""Modular Mysticism."" In the practice of mysticism, Dr. Lenz explains, the student begins to understand awareness and power. Modular mysticism becomes the science of power, and the student learns to gain power, to stop losing power, to store power, and eventually to give power to others. In order to gain power, the student begins to lead an efficient and well-structured life. As the student accomplishes this, they are able to move more easily through the doorways to enlightenment. At each step along the journey of the Insights talks, Dr. Lenz gives specific examples of how to adapt and integrate mystical Buddhist practice into a Western lifestyle. For Dr. Lenz there was no contradiction between being a successful Westerner and a successful Buddhist, be it building a career, working out at the health club, going to the movies, shopping for clothes -- or understanding why more women don't attain enlightenment (when, in fact, it's easier for them to do so). In every instance, Dr. Lenz connects the heights of the mystical experiences directly to our everyday lives."
9781932206104,1932206108,How to Meditate,Frederick Lenz,Meditation,http://books.google.com/books/content?id=HhTVAAAACAAJ&printsec=frontcover&img=1&zoom=1&source=gbs_api,"How to Meditate is a transcript all of Rama's, Dr. Frederick Lenz recorded talks on meditation. It also includes his book of lyrical poetry : ""The Bridge is Flowing but the River is Not."" How to Meditate provides a full range of meditation techniques, knowledge and wisdom to deepen meditation practice and understand meditation's essential role in daily life. This volume is excellent for both newcomers and longtime meditators. Open the book at any time to any page, and you will receive your daily quota of inspiration.",2004.0,0.0,228.0,0.0,"How to Meditate: An Anthology of Talks on Meditation and ""Meditation: the Bridge is Flowing But the River is Not""","9781932206104 How to Meditate is a transcript all of Rama's, Dr. Frederick Lenz recorded talks on meditation. It also includes his book of lyrical poetry : ""The Bridge is Flowing but the River is Not."" How to Meditate provides a full range of meditation techniques, knowledge and wisdom to deepen meditation practice and understand meditation's essential role in daily life. This volume is excellent for both newcomers and longtime meditators. Open the book at any time to any page, and you will receive your daily quota of inspiration."
9781932234299,1932234292,Birthday,Kōji Suzuki;Glynne Walley,Fiction,http://books.google.com/books/content?id=2rEwAAAACAAJ&printsec=frontcover&img=1&zoom=1&source=gbs_api,"Basis of the Hit Movie Ring 0: Birthday! Birthday is Ring-master Koji Suzuki’s return to the Ring universe, a collection of short stories focusing on the female characters with a theme of birth. An exploration of extraordinary circumstances from the perspective of memorable women, this expansion of the Ring, Spiral, and Loop world was adapted into a hit movie less than a year after the book’s publication. Thirty years before the tragic events of Ring, Sadako Yamamura was an aspiring stage actress on the verge of her theatrical debut. The beautiful and ravishing Sadako was the object of every male’s desire involved with the company including n the director. There was one thespian she was interested in, but… Fast forward past the events of Ring, Ryuji Takayama’s distraught lover, Mai Takano is struggling in the wake of the professor’s mysterious demise. Mai visits Ryuji’s parents’ house to find the missing pages of his soon-to-be published article. There she is drawn to a curious videotape and a fate more terrifying than Ryuji or Kazuyuki Asakawa’s. Reiko Sugiura questioned the purpose of bringing a child into a world where there was only death. She already lost one son, and the father of her unborn child, Kaoru Futami, had disappeared in search of a cure to the deadly disease that threatened all life. Despite Kaoru’s to meet again in two months, he has not returned. Despondent but driven for answers Reiko is led to the Loop project, where she will discover the final truths of the Ring virus.",2006.0,3.68,216.0,837.0,Birthday,"9781932234299 Basis of the Hit Movie Ring 0: Birthday! Birthday is Ring-master Koji Suzuki’s return to the Ring universe, a collection of short stories focusing on the female characters with a theme of birth. An exploration of extraordinary circumstances from the perspective of memorable women, this expansion of the Ring, Spiral, and Loop world was adapted into a hit movie less than a year after the book’s publication. Thirty years before the tragic events of Ring, Sadako Yamamura was an aspiring stage actress on the verge of her theatrical debut. The beautiful and ravishing Sadako was the object of every male’s desire involved with the company including n the director. There was one thespian she was interested in, but… Fast forward past the events of Ring, Ryuji Takayama’s distraught lover, Mai Takano is struggling in the wake of the professor’s mysterious demise. Mai visits Ryuji’s parents’ house to find the missing pages of his soon-to-be published article. There she is drawn to a curious videotape and a fate more terrifying than Ryuji or Kazuyuki Asakawa’s. Reiko Sugiura questioned the purpose of bringing a child into a world where there was only death. She already lost one son, and the father of her unborn child, Kaoru Futami, had disappeared in search of a cure to the deadly disease that threatened all life. Despite Kaoru’s to meet again in two months, he has not returned. Despondent but driven for answers Reiko is led to the Loop project, where she will discover the final truths of the Ring virus."
9781932361278,1932361278,There's No Toilet Paper... on the Road Less Traveled,Doug Lansky,Travel,http://books.google.com/books/content?id=Bi0XAQAAMAAJ&printsec=frontcover&img=1&zoom=1&source=gbs_api,"A compendium of humorous travel writing includes contributions from Bill Bryson, Steve Martin, Dave Barry, Art Buchwald, David Letterman, Paul Theroux, and others, presenting stories about everything from surviving in a nudist camp to learning how to use an ice-sheet outhouse in Antarctica. Original.",2005.0,3.4,216.0,403.0,There's No Toilet Paper... on the Road Less Traveled: The Best of Travel Humor and Misadventure,"9781932361278 A compendium of humorous travel writing includes contributions from Bill Bryson, Steve Martin, Dave Barry, Art Buchwald, David Letterman, Paul Theroux, and others, presenting stories about everything from surviving in a nudist camp to learning how to use an ice-sheet outhouse in Antarctica. Original."
9781932382600,1932382607,Richard Matheson's Hell House,Ian Edington;Simon Fraser;Chris Ryall,Comics & Graphic Novels,http://books.google.com/books/content?id=plkKAAAACAAJ&printsec=frontcover&img=1&zoom=1&source=gbs_api,"Now, IDW brings you a lavishly illustrated adaptation of this tale of newspaper publisher Rudolph Deutsch facing his impending demise. To help Deutsch forestall this and learn the secrets of life after death, a hired team of experts must survive a night in Belasco House, a place known amongst the local townsfolk as Hell House!",2004.0,4.08,48.0,13.0,Richard Matheson's Hell House,"9781932382600 Now, IDW brings you a lavishly illustrated adaptation of this tale of newspaper publisher Rudolph Deutsch facing his impending demise. To help Deutsch forestall this and learn the secrets of life after death, a hired team of experts must survive a night in Belasco House, a place known amongst the local townsfolk as Hell House!"
9781932382723,1932382720,Hell House,Ian Edginton;Simon Fraser,Comics & Graphic Novels,http://books.google.com/books/content?id=p1kKAAAACAAJ&printsec=frontcover&img=1&zoom=1&source=gbs_api,The notorious Belasco House starts to exert its dark influence on the group of scientists and spiritualists as they unearth the perverse and wretched secrets from within its walls. Hell House has let them in but will it ever let them leave? IDW's adaptation of Richard Matheson's classic tale of terror continues here!,2005.0,4.5,48.0,8.0,Hell House,9781932382723 The notorious Belasco House starts to exert its dark influence on the group of scientists and spiritualists as they unearth the perverse and wretched secrets from within its walls. Hell House has let them in but will it ever let them leave? IDW's adaptation of Richard Matheson's classic tale of terror continues here!
9781932386226,193238622X,Artesia,Mark Smylie,Comics & Graphic Novels,http://books.google.com/books/content?id=UZ8zngEACAAJ&printsec=frontcover&img=1&zoom=1&source=gbs_api,"In the Highlands of the Middle Kingdoms, where witchcraft and warlords vie for power, a warrior-priestess named Artesia fights for her king against the rulers of rival citadels. Collecting all six issues of the first Artesia mini-series!",2011.0,4.0,192.0,236.0,Artesia,"9781932386226 In the Highlands of the Middle Kingdoms, where witchcraft and warlords vie for power, a warrior-priestess named Artesia fights for her king against the rulers of rival citadels. Collecting all six issues of the first Artesia mini-series!"
9781932416121,1932416129,Timothy McSweeney's,Dave Eggers,Fiction,http://books.google.com/books/content?id=2CHuAAAAMAAJ&printsec=frontcover&img=1&zoom=1&source=gbs_api,"Joshuah Bearman leads a daring investigation into the enigmatic Great Gerbil of central Asia, uncovering signs of an impending disaster. The issue also includes strange and wonderful stories from T.C. Boyle, Susan Straight, Jim Shepard, Wells Tower, and others.",2004.0,3.73,306.0,333.0,Timothy McSweeney's: At War for the Foreseeable Future and He's Never Been So Scared,"9781932416121 Joshuah Bearman leads a daring investigation into the enigmatic Great Gerbil of central Asia, uncovering signs of an impending disaster. The issue also includes strange and wonderful stories from T.C. Boyle, Susan Straight, Jim Shepard, Wells Tower, and others."
9781932416138,1932416137,How We are Hungry,Dave Eggers,Fiction,http://books.google.com/books/content?id=1sALAQAAMAAJ&printsec=frontcover&img=1&zoom=1&source=gbs_api,"A debut collection of short stories presents a compelling cast of characters who struggle with inconvenient revelations, from the deserts of Egypt to the side of Interstate 5.",2004.0,3.75,218.0,486.0,How We are Hungry: Stories,"9781932416138 A debut collection of short stories presents a compelling cast of characters who struggle with inconvenient revelations, from the deserts of Egypt to the side of Interstate 5."
